{
  "$schema": "https://json-schema.org/draft/2020-12/schema",
  "$id": "timeline.schema.json",
  "title": "Timeline Agent Output",
  "description": "Schema for the timeline/sync agent output. Each day contains a timeline object where keys are activity names and values contain start/end times and optional duration.",
  "type": "object",
  "properties": {
    "agent": {
      "type": "string",
      "const": "timeline"
    },
    "status": {
      "type": "string",
      "enum": ["complete"]
    },
    "data": {
      "type": "object",
      "properties": {
        "days": {
          "type": "array",
          "items": {
            "$ref": "#/$defs/day_entry"
          }
        }
      },
      "required": ["days"],
      "additionalProperties": true
    },
    "notes": {
      "type": "string"
    }
  },
  "required": ["agent", "status", "data"],
  "additionalProperties": true,

  "$defs": {
    "timeline_activity": {
      "type": "object",
      "description": "A single timeline activity entry with start/end times.",
      "properties": {
        "start_time": {
          "type": "string",
          "pattern": "^[0-2][0-9]:[0-5][0-9]$",
          "description": "Activity start time in HH:MM format."
        },
        "end_time": {
          "type": "string",
          "pattern": "^[0-2][0-9]:[0-5][0-9]$",
          "description": "Activity end time in HH:MM format."
        },
        "duration_minutes": {
          "type": "number",
          "minimum": 0,
          "description": "Duration in minutes (optional, can be computed from start/end)."
        },
        "transit": {
          "type": "boolean",
          "description": "True if this entry is a transit/travel segment (walk to, taxi to, etc.), not a POI. Used by sync and HTML generator to skip non-POI entries."
        },
        "meal_ref": {
          "type": "string",
          "enum": ["breakfast", "lunch", "dinner"],
          "description": "Links this timeline entry to a meal. Set by migration/timeline agent."
        },
        "accommodation_ref": {
          "type": "boolean",
          "description": "True if this entry references the day's accommodation (e.g. hotel check-in)."
        }
      },
      "required": ["start_time", "end_time"],
      "additionalProperties": true
    },

    "travel_segment": {
      "type": "object",
      "description": "An intra-city transit segment between two activities.",
      "properties": {
        "name_base": {
          "type": "string",
          "description": "English transit description, e.g. 'Taxi to Raffles City Hotel'"
        },
        "name_local": {
          "type": "string",
          "description": "Local language transit description, e.g. '打车前往来福士酒店'"
        },
        "type_base": {
          "type": "string",
          "description": "Transport type in base language (e.g., 'walk', 'taxi', 'metro', 'bus', 'train', 'car', 'ferry', 'transit')",
          "enum": ["walk", "taxi", "metro", "bus", "train", "car", "ferry", "transit"]
        },
        "type_local": {
          "type": "string",
          "description": "Transport type in local language (e.g., '步行', '出租车', '地铁')"
        },
        "icon": {
          "type": "string",
          "description": "Emoji icon for display (e.g., '🚕', '🚇', '🚶')"
        },
        "start_time": {
          "type": "string",
          "pattern": "^[0-2][0-9]:[0-5][0-9]$"
        },
        "end_time": {
          "type": "string",
          "pattern": "^[0-2][0-9]:[0-5][0-9]$"
        },
        "duration_minutes": {
          "type": "number",
          "minimum": 0
        }
      },
      "required": ["name_base", "name_local", "type_base", "start_time", "end_time"],
      "additionalProperties": false
    },

    "day_entry": {
      "type": "object",
      "properties": {
        "day": {
          "type": "integer",
          "minimum": 1,
          "description": "Day number in the trip (1-indexed)."
        },
        "date": {
          "type": "string",
          "description": "Date in YYYY-MM-DD format."
        },
        "timeline": {
          "type": "object",
          "description": "Map of activity name to timeline entry. Keys are human-readable activity names.",
          "patternProperties": {
            "^.+$": {
              "$ref": "#/$defs/timeline_activity"
            }
          },
          "additionalProperties": false
        },
        "travel_segments": {
          "type": "array",
          "description": "Intra-city transit segments between activities. Generated by timeline agent using transportation.json route data.",
          "items": {
            "$ref": "#/$defs/travel_segment"
          }
        }
      },
      "required": ["day", "timeline"],
      "additionalProperties": true
    }
  }
}
