{
  "agent": "timeline",
  "status": "complete",
  "data": {
    "days": [
      {
        "day": 1,
        "date": "2026-05-02",
        "location": "Beijing",
        "timeline": {
          "Arrival: Capital Airport Express + Metro Line 2 (首都机场快轨+地铁2号线)": {
            "start_time": "05:30",
            "end_time": "07:00",
            "duration_minutes": 90,
            "transport_ref": true
          },
          "Freshen up at Jade's home (快速梳洗换衣，不午睡)": {
            "start_time": "07:00",
            "end_time": "08:30",
            "duration_minutes": 90
          },
          "Tianxingju - Xianyukou Branch (天兴居·鲜鱼口店)": {
            "start_time": "08:30",
            "end_time": "09:30",
            "duration_minutes": 60,
            "meal_ref": "breakfast"
          },
          "Dongjiaominxiang Embassy Quarter (东交民巷使馆建筑群)": {
            "start_time": "09:45",
            "end_time": "11:15",
            "duration_minutes": 90
          },
          "VOYAGE COFFEE - Yangmeichu Branch (杨梅竹店)": {
            "start_time": "11:30",
            "end_time": "12:30",
            "duration_minutes": 60
          },
          "Heyan Meat Pie - Qianmen Branch (河沿肉饼·前门店)": {
            "start_time": "13:00",
            "end_time": "13:45",
            "duration_minutes": 45,
            "meal_ref": "lunch"
          },
          "Qianmen Street (前门大街)": {
            "start_time": "14:00",
            "end_time": "15:00",
            "duration_minutes": 60
          },
          "Yangmeizhu Xiejie Hutong (杨梅竹斜街)": {
            "start_time": "15:00",
            "end_time": "17:30",
            "duration_minutes": 150
          },
          "Qiankun Space (乾坤空间)": {
            "start_time": "15:15",
            "end_time": "16:00",
            "duration_minutes": 45
          },
          "Siji Minfu Roast Duck - Financial Street Branch (四季民福烤鸭·金融街店) [TAKEOUT]": {
            "start_time": "19:00",
            "end_time": "20:00",
            "duration_minutes": 60,
            "meal_ref": "dinner"
          },
          "Return to / Arrive at Jade's Home - Wudaokou Ziroom Apartment (五道口自如寓)": {
            "start_time": "20:15",
            "end_time": "20:45",
            "duration_minutes": 30,
            "accommodation_ref": true
          }
        },
        "travel_segments": [
          {
            "name_base": "Airport Express + Metro Line 2 to Qianmen area",
            "name_local": "首都机场快轨+地铁2号线至前门",
            "type_base": "metro",
            "type_local": "地铁",
            "icon": "🚇",
            "start_time": "05:30",
            "end_time": "07:00",
            "duration_minutes": 90
          },
          {
            "name_base": "Metro from Wudaokou to Qianmen (Line 13 + Line 2)",
            "name_local": "地铁从五道口至前门（13号线+2号线）",
            "type_base": "metro",
            "type_local": "地铁",
            "icon": "🚇",
            "start_time": "08:00",
            "end_time": "08:30",
            "duration_minutes": 30
          },
          {
            "name_base": "Walk to Dongjiaominxiang Embassy Quarter",
            "name_local": "步行前往东交民巷使馆建筑群",
            "type_base": "walk",
            "type_local": "步行",
            "icon": "🚶",
            "start_time": "09:30",
            "end_time": "09:45",
            "duration_minutes": 15
          },
          {
            "name_base": "Walk to VOYAGE COFFEE Yangmeichu Branch",
            "name_local": "步行前往VOYAGE COFFEE杨梅竹店",
            "type_base": "walk",
            "type_local": "步行",
            "icon": "🚶",
            "start_time": "11:15",
            "end_time": "11:30",
            "duration_minutes": 15
          },
          {
            "name_base": "Walk to Heyan Meat Pie Qianmen Branch",
            "name_local": "步行前往河沿肉饼前门店",
            "type_base": "walk",
            "type_local": "步行",
            "icon": "🚶",
            "start_time": "12:30",
            "end_time": "13:00",
            "duration_minutes": 30
          },
          {
            "name_base": "Walk to Qianmen Street",
            "name_local": "步行前往前门大街",
            "type_base": "walk",
            "type_local": "步行",
            "icon": "🚶",
            "start_time": "13:45",
            "end_time": "14:00",
            "duration_minutes": 15
          },
          {
            "name_base": "Walk to Yangmeizhu Xiejie Hutong",
            "name_local": "步行前往杨梅竹斜街",
            "type_base": "walk",
            "type_local": "步行",
            "icon": "🚶",
            "start_time": "14:55",
            "end_time": "15:00",
            "duration_minutes": 5
          },
          {
            "name_base": "Metro to Wudaokou (Line 2 + Line 13)",
            "name_local": "地铁返回五道口（2号线+13号线）",
            "type_base": "metro",
            "type_local": "地铁",
            "icon": "🚇",
            "start_time": "17:45",
            "end_time": "18:35",
            "duration_minutes": 50
          },
          {
            "name_base": "Return to Jade's Home - Wudaokou Ziroom Apartment",
            "name_local": "返回五道口自如寓（步行）",
            "type_base": "walk",
            "type_local": "步行",
            "icon": "🚶",
            "start_time": "20:00",
            "end_time": "20:15",
            "duration_minutes": 15
          }
        ],
        "warnings": [
          "Day 1: JET-LAG STRATEGY — stay active in morning, sleep early at night. No midday nap block.",
          "Day 1: Matilde arrives very early (~05:00-07:00). Freshen up at Jade's home 07:00-08:30 (quick shower + change clothes, not a rest).",
          "Day 1: Dongjiaominxiang Embassy Quarter (东交民巷使馆建筑群) RE-ADDED — 09:45-11:15 walking tour (90 min, free outdoor street).",
          "Day 1: VOYAGE COFFEE (杨梅竹店) brought back as morning cafe break 11:30-12:30 after embassy quarter walk.",
          "Day 1: Dinner CHANGED — Siji Minfu Roast Duck 四季民福烤鸭·金融街店 TAKEOUT (外卖) delivered to Jade's Wudaokou home at ~19:00. ORDER BY 18:00 (place order before leaving hutong area ~17:30 via Meituan/Ele.me).",
          "Day 1: Qiankun Space (15:15-16:00) embedded within Yangmeizhu Xiejie Hutong (15:00-17:30) — shopping within the hutong stroll, intentional.",
          "Day 1: Metro departs Qianmen area ~17:45 (after hutong walk). Arrives Wudaokou ~18:35. Takeout order placed before departure; dinner at home 19:00-20:00.",
          "Day 1: Early sleep target 20:30 — per user jet-lag strategy (晚上早点休息).",
          "Day 1: Accommodation is Jade's Home (五道口自如寓) — flexible check-in, no booking required.",
          "Day 1: Dinner at 19:00-20:00 within semantic dinner window (18:00-20:30) — compliant."
        ]
      },
      {
        "day": 2,
        "date": "2026-05-03",
        "location": "Beijing",
        "timeline": {
          "Eryouju Xisi Baozi (二友居西四包子铺)": {
            "start_time": "07:00",
            "end_time": "07:45",
            "duration_minutes": 45,
            "meal_ref": "breakfast"
          },
          "Didi/Taxi to Mutianyu Great Wall (going) (滴滴/出租车前往慕田峪长城)": {
            "start_time": "08:00",
            "end_time": "09:30",
            "duration_minutes": 90
          },
          "Mutianyu Great Wall (慕田峪长城)": {
            "start_time": "09:30",
            "end_time": "14:30",
            "duration_minutes": 300
          },
          "Mutianyu Great Wall Area Restaurant (慕田峪长城景区餐厅)": {
            "start_time": "11:30",
            "end_time": "12:30",
            "duration_minutes": 60,
            "meal_ref": "lunch"
          },
          "Didi/Taxi from Mutianyu Great Wall to Wangfujing (return) (滴滴/出租车从慕田峪返回王府井)": {
            "start_time": "14:30",
            "end_time": "16:00",
            "duration_minutes": 90
          },
          "Free time in Wangfujing area (王府井附近自由休息)": {
            "start_time": "16:00",
            "end_time": "18:00",
            "duration_minutes": 120
          },
          "Zhiguan Xiaoguan (止观小馆)": {
            "start_time": "18:00",
            "end_time": "19:30",
            "duration_minutes": 90,
            "meal_ref": "dinner"
          },
          "Return to Jade's Home - Wudaokou Ziroom Apartment (五道口自如寓)": {
            "start_time": "20:30",
            "end_time": "21:00",
            "duration_minutes": 30,
            "accommodation_ref": true
          }
        },
        "travel_segments": [
          {
            "name_base": "Metro to Xisi Station (for Eryouju Baozi)",
            "name_local": "地铁前往西四站（二友居包子铺）",
            "type_base": "metro",
            "type_local": "地铁",
            "icon": "🚇",
            "start_time": "06:40",
            "end_time": "07:00",
            "duration_minutes": 20
          },
          {
            "name_base": "Taxi to Mutianyu Great Wall Scenic Area",
            "name_local": "打车前往慕田峪长城景区",
            "type_base": "taxi",
            "type_local": "出租车",
            "icon": "🚕",
            "start_time": "08:00",
            "end_time": "09:30",
            "duration_minutes": 90
          },
          {
            "name_base": "Taxi from Mutianyu Great Wall to Wangfujing",
            "name_local": "打车从慕田峪长城至王府井",
            "type_base": "taxi",
            "type_local": "出租车",
            "icon": "🚕",
            "start_time": "14:30",
            "end_time": "16:00",
            "duration_minutes": 90
          },
          {
            "name_base": "Return to Jade's Home - Wudaokou Ziroom Apartment",
            "name_local": "返回五道口自如寓",
            "type_base": "metro",
            "type_local": "地铁",
            "icon": "🚇",
            "start_time": "19:30",
            "end_time": "20:30",
            "duration_minutes": 60
          }
        ],
        "warnings": [
          "Day 2: Dinner CHANGED to 止观小馆 (Zhiguan Xiaoguan) — 2026 Michelin 1-Star, 533 CNY/person. Location: 王府井金鱼胡同12号. Hours: 17:30-21:00.",
          "Day 2: Afternoon return from Mutianyu goes to WANGFUJING (not Sanlitun) — 止观小馆 is in Wangfujing Dongcheng.",